<?xml version="1.0" encoding="UTF-8"?>
<CACHECONFIG
  xmlns="http://mem4csd.telecom-paris.fr/OtawaCache"
  xmlns:xsi="http://www.w3.org/2001/XMLSchema-instance"
  xsi:schemaLocation="http://mem4csd.telecom-paris.fr/OtawaCache OtawaCache.xsd">
  <dcache>
    <block_bits>5</block_bits>
    <way_bits>2</way_bits>
    <row_bits>9</row_bits>
    <miss_penalty>25</miss_penalty>
  </dcache>
  <icache>
    <block_bits>5</block_bits>
    <way_bits>2</way_bits>
    <row_bits>9</row_bits>
    <miss_penalty>25</miss_penalty>
  </icache>
</CACHECONFIG>
